{
  "specVersion": "0.1.0",
  "manifest": {
    "id": "example-rpg.profile-demo",
    "title": "Example RPG Profile Demonstration Bundle",
    "datasetVersion": "0.1.0",
    "description": "A profile-scoped demonstration bundle used to verify CRGS architecture."
  },
  "profile": {
    "id": "example.profile.demo",
    "name": "Example RPG",
    "version": "0.1.0",
    "specVersion": "0.1.0",
    "extensions": {
      "entityTypes": [
        {
          "id": "example.entity.trait",
          "schema": "https://schemas.codryn.com/crgs/profiles/example/v0.1/entities/trait.schema.json"
        },
        {
          "id": "example.entity.selection",
          "schema": "https://schemas.codryn.com/crgs/profiles/example/v0.1/entities/selection.schema.json"
        }
      ],
      "requirementTypes": [
        {
          "id": "example.requirement.attribute-rating",
          "schema": "https://schemas.codryn.com/crgs/profiles/example/v0.1/requirements/attribute-rating.schema.json"
        },
        {
          "id": "example.requirement.skill-rating",
          "schema": "https://schemas.codryn.com/crgs/profiles/example/v0.1/requirements/skill-rating.schema.json"
        }
      ],
      "effectTypes": [
        {
          "id": "example.effect.grant",
          "schema": "https://schemas.codryn.com/crgs/profiles/example/v0.1/effects/grant.schema.json"
        },
        {
          "id": "example.effect.increase",
          "schema": "https://schemas.codryn.com/crgs/profiles/example/v0.1/effects/increase.schema.json"
        }
      ],
      "relationTypes": [
        {
          "id": "example.relation.grants",
          "schema": "https://schemas.codryn.com/crgs/profiles/example/v0.1/relations/grants.schema.json"
        },
        {
          "id": "example.relation.depends-on",
          "schema": "https://schemas.codryn.com/crgs/profiles/example/v0.1/relations/depends-on.schema.json"
        }
      ]
    }
  },
  "entities": [
    {
      "id": "selection.origin",
      "type": "example.entity.selection",
      "label": {
        "default": "Origin Selection"
      }
    },
    {
      "id": "trait.brave",
      "type": "example.entity.trait",
      "label": {
        "default": "Brave"
      },
      "requirements": {
        "kind": "fact",
        "fact": "selected:origin",
        "operator": "present"
      },
      "effects": [
        {
          "type": "example.effect.grant",
          "target": "capability.advantage.fear",
          "operation": "grant",
          "value": true
        }
      ]
    }
  ],
  "relationships": [
    {
      "id": "rel.origin-grants-brave",
      "type": "example.relation.grants",
      "from": "selection.origin",
      "to": "trait.brave"
    }
  ]
}
