{
  "specVersion": "0.2.0",
  "manifest": {
    "id": "conformance.valid.minimal-entity",
    "title": "Minimal Entity",
    "datasetVersion": "0.2.0"
  },
  "profile": {
    "id": "example.profile.demo",
    "name": "Example Demo",
    "version": "0.2.0",
    "specVersion": "0.2.0",
    "extensions": {
      "entityTypes": [
        {
          "id": "example.entity.ability",
          "schema": "https://schemas.codryn.com/crgs/profiles/example/v0.2/entities/ability.schema.json"
        }
      ]
    }
  },
  "entities": [
    {
      "id": "example.ability.arcane-training",
      "type": "example.entity.ability",
      "label": {
        "default": "Arcane Training"
      }
    }
  ],
  "relationships": []
}
