{
  "specVersion": "0.1.0",
  "manifest": {
    "id": "conformance.valid.nested-requirements",
    "title": "Nested Requirements",
    "datasetVersion": "0.1.0"
  },
  "profile": {
    "id": "example.profile.demo",
    "name": "Example Demo",
    "version": "0.1.0",
    "specVersion": "0.1.0",
    "extensions": {
      "entityTypes": [
        {
          "id": "example.entity.ability",
          "schema": "https://schemas.codryn.com/crgs/profiles/example/v0.1/entities/ability.schema.json"
        }
      ]
    }
  },
  "entities": [
    {
      "id": "example.ability.arcane-training",
      "type": "example.entity.ability",
      "label": {
        "default": "Arcane Training"
      }
    },
    {
      "id": "example.ability.powerful-strike",
      "type": "example.entity.ability",
      "label": {
        "default": "Powerful Strike"
      },
      "requirements": {
        "kind": "group",
        "mode": "all",
        "children": [
          {
            "kind": "fact",
            "fact": "selected:ability",
            "operator": "equals",
            "value": "example.ability.arcane-training"
          },
          {
            "kind": "group",
            "mode": "any",
            "children": [
              {
                "kind": "fact",
                "fact": "attribute:strength",
                "operator": "atLeast",
                "value": 3
              },
              {
                "kind": "fact",
                "fact": "profile:demo-mode",
                "operator": "present"
              }
            ]
          }
        ]
      }
    }
  ],
  "relationships": []
}