{
  "specVersion": "0.1.0",
  "manifest": {
    "id": "conformance.valid.profile-extension",
    "title": "Profile Extension",
    "datasetVersion": "0.1.0"
  },
  "profile": {
    "id": "example.profile.demo",
    "name": "Example Demo",
    "version": "0.1.0",
    "specVersion": "0.1.0",
    "extensions": {
      "entityTypes": [
        {
          "id": "example.entity.ability",
          "schema": "https://schemas.codryn.com/crgs/profiles/example/v0.1/entities/ability.schema.json"
        }
      ],
      "requirementTypes": [
        {
          "id": "example.requirement.attribute-rating",
          "schema": "https://schemas.codryn.com/crgs/profiles/example/v0.1/requirements/attribute-rating.schema.json"
        }
      ]
    }
  },
  "entities": [
    {
      "id": "example.ability.powerful-strike",
      "type": "example.entity.ability",
      "label": {
        "default": "Powerful Strike"
      },
      "requirements": {
        "kind": "example.requirement.attribute-rating",
        "attribute": "strength",
        "minimum": 3
      }
    }
  ],
  "relationships": []
}
